claim_id,claim,authority_tier,evidence_file,evidence_locator,note
C1,"Accepted project scope is the revised clipped-energy plan, not the broader old project.",core_definition,project_v2_1.txt,accepted project scope,Strategic state is locked to the clipped path; runtime does not require external project-knowledge bundles.
C2,Stage B found one short-horizon in-domain bracket for alpha=0.0 between c_upd=0.50 and 0.60.,authoritative_boundary,runs/stageB_completion_bridge_reports/STAGE_B_COMPLETION_REPORT.txt,alpha=0.0 classification=in_domain_bracket_ready,Bridge result only; not the final full-horizon map.
C3,Stage C completed 1088/1088 runs and found no interior in-domain full-horizon boundary.,authoritative_boundary,runs/stageC_subset_refine_reports/STAGE_C_SUBSET_FULL_HORIZON_REPORT.txt,"completed_runs=1088, in_domain_count=0, right_censored_count=11",Stage C is the source of truth for final boundary claims.
C4,Alpha=0.0 stayed above threshold through c_upd=0.58 at full horizon.,authoritative_boundary,runs/stageC_subset_refine_reports/STAGE_C_SUBSET_FULL_HORIZON_REPORT.txt,alpha=0.0 boundary evidence,Right-censored above sampled refine band.
C5,Alpha=0.1 to 1.0 remained right-censored above c_upd=1.0 at full horizon.,authoritative_boundary,runs/stageC_subset_refine_reports/STAGE_C_SUBSET_FULL_HORIZON_REPORT.txt,alpha=0.1..1.0 entries,Full-horizon map is right-censored in the physical domain.
C6,"Stage D is mechanism-only evidence with enabled_full, fragile_full, and disabled_short representatives.",supportive_mechanism,runs/stageD_representative_mechanistic_traces/STAGE_D_REPRESENTATIVE_MECHANISTIC_TRACES_REPORT.txt,Selected conditions,"Useful for mechanism, not for boundary truth."
C7,Known audit caveat: the uploaded Stage D fragile_full endpoint summary does not align perfectly with Stage C.,audit_caveat,Stage C by-point CSV vs Stage D endpoint summary CSV,"alpha=0.0, c_upd=0.58 comparison",Return gap=0.655048; Stage C remains authoritative.
C8,Likely periodic VarTD beat explanation: NUM_STEPS=128 and episode_len=26 imply a 13-update alignment cycle.,reasoned_consistency_check,locked constants + arithmetic,"lcm=1664, beat_updates=13",Reasoned explanation consistent with setup; not directly logged theorem.
